The local lake reached record high levels.,"The local lake reached record high levels.",1,"Record-breaking rainfall hits region",2,"Nothing unusual in lake levels, say officials",2  
A new school policy was introduced.,Students protest new school rules,1,School board implements changes,2,Strict new policy raises eyebrows,3  
Recycling rates increased by 15%.,City applauds recycling success,1,More residents sorting waste correctly,2,Critics say increase is 'exaggerated',3  
The mayor announced a new housing plan.,Mayor promises affordable housing,1,Bold new plan to tackle homelessness,2,Some call housing plan unrealistic,3  
Rations increased by 5% this quarter.,"Rations increased by 5% this quarter.",1,"Ministry of Plenty reports surplus",2,"Some claim rations still insufficient",3  
Victory Square parade draws record attendance.,"Victory Square parade draws record attendance.",1,"Citizens celebrate Party's achievements",2,"Rumors of mandatory attendance denied",3  
New telescreens installed in all districts.,"New telescreens installed in all districts.",1,"Improved surveillance for public safety",2,"Few report minor technical issues",3  
Productivity exceeds quotas in Factory 17.,"Productivity exceeds quotas in Factory 17.",1,"Workers praised for exceptional effort",2,"Some suspect falsified records",3  
Enemy forces suffer heavy losses, reports say.,"Enemy forces suffer heavy losses, reports say.",1,"War effort progressing as planned",2,"Dissenters question accuracy of claims",3  
New language guide simplifies Newspeak terms.,"New language guide simplifies Newspeak terms.",1,"Ministry of Truth promotes clarity",2,"A few find changes 'unnecessary'",3  
Electricity supply stabilized after brief outage.,"Electricity supply stabilized after brief outage.",1,"Ministry of Power resolves issue swiftly",2,"Some recall longer blackouts",3  
Youth League membership reaches all-time high.,"Youth League membership reaches all-time high.",1,"Loyalty to Party stronger than ever",2,"Whispers of coerced sign-ups persist",3  
Crime rates drop for third consecutive year.,"Crime rates drop for third consecutive year.",1,"Police vigilance praised",2,"Some doubt reported statistics",3  
New communal dining halls open in Sector 5.,"New communal dining halls open in Sector 5.",1,"Efficiency in food distribution improved",2,"A few complain of bland meals",3  
Oceania athletes dominate latest competitions.,"Oceania athletes dominate latest competitions.",1,"Physical health prioritized by Party",2,"Some suspect performance enhancements",3  
Thoughtcrime arrests decline, officials report.,"Thoughtcrime arrests decline, officials report.",1,"Citizens embrace correct thinking",2,"Rumors of unreported cases circulate",3  
New patriotic film breaks viewership records.,"New patriotic film breaks viewership records.",1,"Ministry of Culture celebrates success",2,"A few call it 'propaganda'",3  
Coal production exceeds expectations.,"Coal production exceeds expectations.",1,"Miners honored for dedication",2,"Some workers report exhaustion",3  
Two Minutes Hate participation at 98%.,"Two Minutes Hate participation at 98%.",1,"Unity against enemies reinforced",2,"A handful absent for 'unknown reasons'",3
